<?xml version="1.0" encoding="ISO_8859-1"?>
<mycoreuser xmlns:xsi="http://www.w3.org/2001/XMLSchema-instance" xmlns:xlink="http://www.w3.org/1999/xlink" xsi:noNamespaceSchemaLocation="MCRUser.xsd">
  <user numID="15" ID="author2A" id_enabled="true" update_allowed="true">
    <user.password>author2A</user.password>
    <user.description>Bereichtigter Autor der Gruppe 2</user.description>
    <user.primary_group>authorgroup2</user.primary_group>
    <user.contact>
      <contact.salutation />
      <contact.firstname />
      <contact.lastname>Autor A der Gruppe 2</contact.lastname>
      <contact.street />
      <contact.city />
      <contact.postalcode />
      <contact.country />
      <contact.state />
      <contact.institution />
      <contact.faculty />
      <contact.department />
      <contact.institute />
      <contact.telephone />
      <contact.fax />
      <contact.email />
      <contact.cellphone />
    </user.contact>
  </user>
</mycoreuser>

